{
  "job_id": "00000000-0000-4000-8000-000000000006",
  "stage": "07_COVERS",
  "config_source": "public",
  "config_version": "v1",
  "model": "synthetic-model-v0",
  "execution_id": "exec-r006",
  "created_at": "2026-10-23T12:00:00Z",
  "visual_spec_id": "vs-0001",
  "template_id": "reel-02-overlay",
  "evidence_ids": [
    "ev-0001"
  ],
  "slots": [
    {
      "slot_id": "label_top",
      "kind": "chrome",
      "lines": [
        "REELS / OVERLAY 006"
      ]
    },
    {
      "slot_id": "chapter_label",
      "kind": "chrome",
      "lines": [
        "CAPÍTULO 02 / SINTÉTICO"
      ]
    },
    {
      "slot_id": "headline",
      "kind": "claim",
      "lines": [
        "Mais",
        "clareza."
      ]
    },
    {
      "slot_id": "cfm_footer",
      "kind": "chrome",
      "lines": [
        "Nome Sintético – MÉDICO – CRM/SP 000000"
      ]
    }
  ],
  "alt_text": "Texto Mais clareza sobreposto a um vídeo, no capítulo 02."
}
