{
  "job_id": "00000000-0000-4000-8000-000000000003",
  "stage": "07_COVERS",
  "config_source": "public",
  "config_version": "v1",
  "model": "synthetic-model-v0",
  "execution_id": "exec-r003",
  "created_at": "2026-10-23T12:00:00Z",
  "visual_spec_id": "vs-0001",
  "template_id": "carousel-01-capa",
  "evidence_ids": [
    "ev-0001"
  ],
  "slots": [
    {
      "slot_id": "label_top",
      "kind": "chrome",
      "lines": [
        "CARROSSEL / 003"
      ]
    },
    {
      "slot_id": "numeral",
      "kind": "chrome",
      "lines": [
        "01"
      ]
    },
    {
      "slot_id": "headline",
      "kind": "claim",
      "lines": [
        "Três etapas",
        "para decidir",
        "com dados."
      ]
    },
    {
      "slot_id": "footer_left",
      "kind": "chrome",
      "lines": [
        "ARRASTE"
      ]
    },
    {
      "slot_id": "counter",
      "kind": "chrome",
      "lines": [
        "01 / 06"
      ]
    },
    {
      "slot_id": "cfm_footer",
      "kind": "chrome",
      "lines": [
        "Nome Sintético – MÉDICO – CRM/SP 000000"
      ]
    }
  ],
  "alt_text": "Capa escura de carrossel com o numeral 01 e o título Três etapas para decidir com dados."
}
