{
  "job_id": "00000000-0000-4000-8000-000000000002",
  "stage": "07_COVERS",
  "config_source": "public",
  "config_version": "v1",
  "model": "synthetic-model-v0",
  "execution_id": "exec-r002",
  "created_at": "2026-10-23T12:00:00Z",
  "visual_spec_id": "vs-0001",
  "template_id": "post-02-metrica",
  "evidence_ids": [
    "ev-0001"
  ],
  "slots": [
    {
      "slot_id": "label_top",
      "kind": "chrome",
      "lines": [
        "INSIGHTS / 002"
      ]
    },
    {
      "slot_id": "headline",
      "kind": "claim",
      "lines": [
        "Indicador",
        "sobe no",
        "ano."
      ]
    },
    {
      "slot_id": "metric_value",
      "kind": "claim",
      "lines": [
        "92%"
      ]
    },
    {
      "slot_id": "metric_label",
      "kind": "claim",
      "lines": [
        "INDICADOR SINTÉTICO"
      ]
    },
    {
      "slot_id": "subhead",
      "kind": "claim",
      "lines": [
        "Uma métrica. Uma mensagem."
      ]
    },
    {
      "slot_id": "footer_left",
      "kind": "chrome",
      "lines": [
        "EDITORIAL / SINTÉTICO"
      ]
    },
    {
      "slot_id": "counter",
      "kind": "chrome",
      "lines": [
        "01 / 06"
      ]
    },
    {
      "slot_id": "cfm_footer",
      "kind": "chrome",
      "lines": [
        "Nome Sintético – MÉDICO – CRM/SP 000000"
      ]
    }
  ],
  "alt_text": "Capa escura com o número 92% em destaque e a frase Indicador sobe no ano."
}
