{
  "job_id": "00000000-0000-4000-8000-000000000001",
  "stage": "07_COVERS",
  "config_source": "public",
  "config_version": "v1",
  "model": "synthetic-model-v0",
  "execution_id": "exec-r001",
  "created_at": "2026-10-23T12:00:00Z",
  "visual_spec_id": "vs-0001",
  "template_id": "post-01-manifesto",
  "evidence_ids": [
    "ev-0001"
  ],
  "slots": [
    {
      "slot_id": "label_top",
      "kind": "chrome",
      "lines": [
        "SINTÉTICO / 001"
      ]
    },
    {
      "slot_id": "headline",
      "kind": "claim",
      "lines": [
        "Dados que",
        "orientam."
      ]
    },
    {
      "slot_id": "subhead",
      "kind": "claim",
      "lines": [
        "Indicador sintético em um ano."
      ]
    },
    {
      "slot_id": "cta_label",
      "kind": "claim",
      "lines": [
        "Salve este post"
      ]
    },
    {
      "slot_id": "footer_left",
      "kind": "chrome",
      "lines": [
        "SINTÉTICO / LAB"
      ]
    },
    {
      "slot_id": "counter",
      "kind": "chrome",
      "lines": [
        "01 / 06"
      ]
    },
    {
      "slot_id": "cfm_footer",
      "kind": "chrome",
      "lines": [
        "Nome Sintético – MÉDICO – CRM/SP 000000"
      ]
    }
  ],
  "alt_text": "Capa escura com a frase Dados que orientam e a chamada Salve este post."
}
