{
  "job_id": "00000000-0000-4000-8000-000000000004",
  "stage": "07_COVERS",
  "config_source": "public",
  "config_version": "v1",
  "model": "synthetic-model-v0",
  "execution_id": "exec-r004",
  "created_at": "2026-10-23T12:00:00Z",
  "visual_spec_id": "vs-0001",
  "template_id": "story-01-convite",
  "evidence_ids": [
    "ev-0001"
  ],
  "slots": [
    {
      "slot_id": "label_top",
      "kind": "chrome",
      "lines": [
        "STORY / 004"
      ]
    },
    {
      "slot_id": "headline",
      "kind": "claim",
      "lines": [
        "Dado",
        "primeiro."
      ]
    },
    {
      "slot_id": "subhead",
      "kind": "claim",
      "lines": [
        "Decisão vem depois."
      ]
    },
    {
      "slot_id": "highlight_label",
      "kind": "chrome",
      "lines": [
        "EM DESTAQUE"
      ]
    },
    {
      "slot_id": "highlight",
      "kind": "claim",
      "lines": [
        "Menos ruído,",
        "mais critério."
      ]
    },
    {
      "slot_id": "cta_label",
      "kind": "claim",
      "lines": [
        "Comente abaixo"
      ]
    },
    {
      "slot_id": "cfm_footer",
      "kind": "chrome",
      "lines": [
        "Nome Sintético – MÉDICO – CRM/SP 000000"
      ]
    }
  ],
  "alt_text": "Story escuro com o título Dado primeiro, um destaque e a chamada Comente abaixo."
}
